{
  "$schema": "https://json-schema.org/draft/2020-12/schema",
  "$id": "https://bank.example/schemas/webis/search-request.schema.json",
  "title": "SearchRequest",
  "description": "Inbound contract for WEBIS-SEARCH. Every field that widens the search surface is explicit, reviewable and logged; the agent infers nothing about scope.",
  "type": "object",
  "required": ["request_id", "subject"],
  "additionalProperties": false,
  "properties": {
    "request_id": {"type": "string", "pattern": "^SR-[0-9]{4,8}$"},
    "subject": {"type": "string", "minLength": 2, "maxLength": 200,
                "description": "Legal name (or person name) as it appears on the KYC file."},
    "case_id": {"type": "string", "pattern": "^CASE-[0-9]{4}$",
                "description": "Links the pack back to the CDD case; absent only for standalone runs."},
    "attributes": {
      "type": "object",
      "description": "Discriminators used by SK-S5b. Absent attributes never exclude a source.",
      "additionalProperties": false,
      "properties": {
        "dob": {"type": "string", "pattern": "^[0-9]{4}-[0-9]{2}-[0-9]{2}$"},
        "country": {"type": "string", "pattern": "^[A-Z]{2}$"},
        "registration_number": {"type": "string"}
      }
    },
    "related_parties": {"type": "array", "maxItems": 20, "items": {"type": "string", "maxLength": 200},
                        "description": "UBOs and directors, screened in their own right (SK-S1)."},
    "facets": {"type": "array",
               "items": {"enum": ["IDENTITY", "ADVERSE", "REGULATORY", "CORPORATE_STATUS", "COUNTERPARTY", "RELATED_PARTY"]}},
    "max_queries": {"type": "integer", "minimum": 1, "maximum": 40},
    "per_query_limit": {"type": "integer", "minimum": 1, "maximum": 10},
    "retrieved_at": {"type": "string", "format": "date-time",
                     "description": "Pinned clock. Two runs with the same value must be byte-identical."},
    "resume": {"type": "boolean", "default": true}
  }
}
