{
  "attributes": {
    "country": "CA",
    "dob": "1992-10-26"
  },
  "case_id": "CASE-700136",
  "facets": [
    "IDENTITY",
    "ADVERSE",
    "REGULATORY"
  ],
  "max_queries": 18,
  "per_query_limit": 4,
  "related_parties": [],
  "request_id": "SR-700136",
  "retrieved_at": "2026-10-20T12:00:00Z",
  "subject": "Hale Trialford 700136"
}
