{
  "attributes": {
    "country": "DE",
    "dob": "1986-10-17"
  },
  "case_id": "CASE-700160",
  "facets": [
    "IDENTITY",
    "ADVERSE",
    "REGULATORY"
  ],
  "max_queries": 18,
  "per_query_limit": 4,
  "related_parties": [],
  "request_id": "SR-700160",
  "retrieved_at": "2026-10-20T12:00:00Z",
  "subject": "Bela Simvale 700160"
}
