{
  "attributes": {
    "country": "GB",
    "dob": "1980-04-26"
  },
  "case_id": "CASE-700154",
  "facets": [
    "IDENTITY",
    "ADVERSE",
    "REGULATORY"
  ],
  "max_queries": 18,
  "per_query_limit": 4,
  "related_parties": [],
  "request_id": "SR-700154",
  "retrieved_at": "2026-10-20T12:00:00Z",
  "subject": "Fara Trialford 700154"
}
