{
  "attributes": {
    "registration_number": "TST-700204"
  },
  "case_id": "CASE-700204",
  "facets": [
    "IDENTITY",
    "ADVERSE",
    "REGULATORY"
  ],
  "max_queries": 18,
  "per_query_limit": 4,
  "related_parties": [
    "Fara Mockley 700204",
    "Galen Trialford 700204"
  ],
  "request_id": "SR-700204",
  "retrieved_at": "2026-10-20T12:00:00Z",
  "subject": "Eli Exampleton Trading 700204 Ltd"
}
