{
  "attributes": {
    "registration_number": "TST-700258"
  },
  "case_id": "CASE-700258",
  "facets": [
    "IDENTITY",
    "ADVERSE",
    "REGULATORY"
  ],
  "max_queries": 18,
  "per_query_limit": 4,
  "related_parties": [
    "Jori Mockley 700258",
    "Ari Trialford 700258"
  ],
  "request_id": "SR-700258",
  "retrieved_at": "2026-10-20T12:00:00Z",
  "subject": "Iva Exampleton Trading 700258 Ltd"
}
