{
  "attributes": {
    "registration_number": "TST-700197"
  },
  "case_id": "CASE-700197",
  "facets": [
    "IDENTITY",
    "ADVERSE",
    "REGULATORY"
  ],
  "max_queries": 18,
  "per_query_limit": 4,
  "related_parties": [
    "Iva Testwell 700197",
    "Jori Sampleton 700197"
  ],
  "request_id": "SR-700197",
  "retrieved_at": "2026-10-20T12:00:00Z",
  "subject": "Hale Trialford Trading 700197 Ltd"
}
