{
  "attributes": {
    "registration_number": "TST-700004"
  },
  "case_id": "CASE-700004",
  "facets": [
    "IDENTITY",
    "ADVERSE",
    "REGULATORY"
  ],
  "max_queries": 18,
  "per_query_limit": 4,
  "related_parties": [
    "Fara Sampleton 700004",
    "Galen Mockley 700004"
  ],
  "request_id": "SR-700004",
  "retrieved_at": "2026-10-20T12:00:00Z",
  "subject": "Eli Mockley Trading 700004 Ltd"
}
