{
  "attributes": {
    "registration_number": "TST-700028"
  },
  "case_id": "CASE-700028",
  "facets": [
    "IDENTITY",
    "ADVERSE",
    "REGULATORY"
  ],
  "max_queries": 18,
  "per_query_limit": 4,
  "related_parties": [
    "Jori Trialford 700028",
    "Ari Exampleton 700028"
  ],
  "request_id": "SR-700028",
  "retrieved_at": "2026-10-20T12:00:00Z",
  "subject": "Iva Mockley Trading 700028 Ltd"
}
