{
  "attributes": {
    "registration_number": "TST-700031"
  },
  "case_id": "CASE-700031",
  "facets": [
    "IDENTITY",
    "ADVERSE",
    "REGULATORY"
  ],
  "max_queries": 18,
  "per_query_limit": 4,
  "related_parties": [
    "Cato Exampleton 700031",
    "Dara Simvale 700031"
  ],
  "request_id": "SR-700031",
  "retrieved_at": "2026-10-20T12:00:00Z",
  "subject": "Bela Simvale Trading 700031 Ltd"
}
