{
  "attributes": {
    "registration_number": "TST-700216"
  },
  "case_id": "CASE-700216",
  "facets": [
    "IDENTITY",
    "ADVERSE",
    "REGULATORY"
  ],
  "max_queries": 18,
  "per_query_limit": 4,
  "related_parties": [
    "Hale Testwell 700216",
    "Iva Sampleton 700216"
  ],
  "request_id": "SR-700216",
  "retrieved_at": "2026-10-20T12:00:00Z",
  "subject": "Galen Exampleton Trading 700216 Ltd"
}
