{
  "attributes": {
    "registration_number": "TST-700023"
  },
  "case_id": "CASE-700023",
  "facets": [
    "IDENTITY",
    "ADVERSE",
    "REGULATORY"
  ],
  "max_queries": 18,
  "per_query_limit": 4,
  "related_parties": [
    "Eli Mockley 700023",
    "Fara Trialford 700023"
  ],
  "request_id": "SR-700023",
  "retrieved_at": "2026-10-20T12:00:00Z",
  "subject": "Dara Trialford Trading 700023 Ltd"
}
